{
  "schemaVersion": "1.0.0",
  "cardId": "CX-517",
  "worldId": "lingmai-ember-red-mist",
  "createdOn": "2026-08-03",
  "artDirectionSource": {
    "path": "content/story/red-mist/red-mist-art-direction.cx516.json",
    "sha256": "0ba5b0fec6a2e3ed96ba75ce0c2818e91e96d03010bf463c1c3cacfda72c6deb"
  },
  "generationPolicy": {
    "imageProvider": "codex_builtin_imagegen",
    "stillImagesOnly": true,
    "videoOrAudioUsed": false,
    "flow2ApiUsed": false,
    "geminiUsed": false,
    "veoUsed": false,
    "overwriteExistingAssets": false,
    "generationCalls": 15,
    "discardedOutputs": 2,
    "acceptedCandidateFiles": 13,
    "expressionsDeferredUntilMultiviewApproval": true,
    "cx514Status": "paused"
  },
  "anchorSources": [
    {
      "assetId": "identity.shen_yan.v1",
      "path": "content/visual-candidates/cx508/identity-anchors/identity_shen_yan_v1.png",
      "sha256": "1a0973205fac132f1f5d3c658f8921200d5ce4ca7575182a2c85ab80eb166e50"
    },
    {
      "assetId": "identity.chu_mingqi.v2",
      "path": "content/visual-candidates/cx509/identity-anchors/identity_chu_mingqi_v2.png",
      "sha256": "ad13ade5efe7c4451919b16ede690520de64e6ae79680e55f7a1926c6cac29ae"
    },
    {
      "assetId": "identity.shi_jun.v3",
      "path": "content/visual-candidates/cx509/identity-anchors/identity_shi_jun_v3.png",
      "sha256": "cf29b3028d2e55a8be4cc7bf0fd2141f7426046bdcde776f47537ea35294d613"
    },
    {
      "assetId": "identity.celadon_scout.v3",
      "path": "content/visual-candidates/cx510/identity-anchors/identity_celadon_scout_v3.png",
      "sha256": "9bd742b2affe58c78dd0b309d7e5908f88000e3c2a32309b68fac296617d2139"
    },
    {
      "assetId": "identity.cavern_ally.v1",
      "path": "content/visual-candidates/cx508/identity-anchors/identity_cavern_ally_v1.png",
      "sha256": "60fa153e34eab624ba8c429274e640420778082c5d3001f38b6d73bc9d35947d"
    },
    {
      "assetId": "identity.formation_spirit.v2",
      "path": "content/visual-candidates/cx509/identity-anchors/identity_formation_spirit_v2.png",
      "sha256": "def223bd873b3e4b23082a2863bd2bea0e3ab5d076ceb7d64286bd49150627e2"
    },
    {
      "assetId": "creature.ink_dragon.v3",
      "path": "content/visual-candidates/cx509/identity-anchors/creature_ink_dragon_v3.png",
      "sha256": "4d200963ee5619880544bca3c498f724dd3940296035d1dd225c5ea30735b2e4"
    }
  ],
  "requiredCandidateIds": [
    "turnaround.outfit.shen_yan_qinglan_travel.v1",
    "turnaround.outfit.shen_yan_xuanheng_ceremony.v1",
    "turnaround.outfit.shen_yan_yaoyuan_combat.v1",
    "turnaround.outfit.chu_mingqi_jiyue_travel.v1",
    "turnaround.outfit.chu_mingqi_danque_ceremony.v1",
    "turnaround.outfit.chu_mingqi_chixiao_combat.v1",
    "turnaround.outfit.shi_jun_cangjin_command.v1",
    "turnaround.outfit.shi_jun_anyao_ritual.v1",
    "turnaround.outfit.celadon_scout_listening.v1",
    "turnaround.outfit.celadon_scout_night_patrol.v1",
    "turnaround.outfit.cavern_ally_stone_lamp.v1",
    "turnaround.outfit.formation_spirit_star_balance.v1",
    "turnaround.creature.ink_dragon.v1"
  ],
  "candidates": [
    {
      "assetId": "turnaround.outfit.shen_yan_qinglan_travel.v1",
      "assetKind": "outfit_turnaround",
      "subjectId": "character.shen_yan",
      "outfitId": "outfit.shen_yan_qinglan_travel.v1",
      "sourceAnchor": {
        "assetId": "identity.shen_yan.v1",
        "path": "content/visual-candidates/cx508/identity-anchors/identity_shen_yan_v1.png",
        "sha256": "1a0973205fac132f1f5d3c658f8921200d5ce4ca7575182a2c85ab80eb166e50"
      },
      "generationMode": "codex_builtin_imagegen",
      "adoptionStatus": "needs_review",
      "adopted": false,
      "shipInBuild": false,
      "outputPath": "content/visual-candidates/cx517/turnarounds/turnaround_outfit_shen_yan_qinglan_travel_v1.png",
      "views": ["front", "left_profile", "back"],
      "prompt": "Preserve the approved fictional Shen Yan face, age, topknot, body and medicine case across exactly front, left profile and back full-body studio views. Replace clothing with clean celadon and ivory Song-inspired Qinglan travel layers, woven sash and dark textile boots; keep the case rigid and identical. Use bright warm-ivory 85mm studio realism, physical cloth and contact shadow; exclude scenery, text, extra people, leather, Qing styling and actor likeness.",
      "continuityLocks": ["same_face", "same_hair", "same_anatomy", "same_outfit", "same_footwear", "same_prop"],
      "avoidItems": ["no_text", "no_watermark", "no_extra_people", "no_actor_likeness", "no_modern_leather", "no_qing_clothing", "no_identity_drift", "no_prop_mutation"],
      "reviewStatus": "pending_human_review",
      "reviewChecks": ["identity_consistency", "view_consistency", "proportions", "hands", "feet", "garment_construction", "material_fidelity", "footwear", "prop_continuity", "no_text_or_watermark", "no_actor_likeness"],
      "artifact": {"mediaType": "image/png", "byteLength": 2072028, "width": 1536, "height": 1024, "sha256": "48548c9b77e9e6b1225f29bda1686bb1c00ffb3c6707f92325f055a1fef481fe"}
    },
    {
      "assetId": "turnaround.outfit.shen_yan_xuanheng_ceremony.v1",
      "assetKind": "outfit_turnaround",
      "subjectId": "character.shen_yan",
      "outfitId": "outfit.shen_yan_xuanheng_ceremony.v1",
      "sourceAnchor": {
        "assetId": "identity.shen_yan.v1",
        "path": "content/visual-candidates/cx508/identity-anchors/identity_shen_yan_v1.png",
        "sha256": "1a0973205fac132f1f5d3c658f8921200d5ce4ca7575182a2c85ab80eb166e50"
      },
      "generationMode": "codex_builtin_imagegen",
      "adoptionStatus": "needs_review",
      "adopted": false,
      "shipInBuild": false,
      "outputPath": "content/visual-candidates/cx517/turnarounds/turnaround_outfit_shen_yan_xuanheng_ceremony_v1.png",
      "views": ["front", "left_profile", "back"],
      "prompt": "Preserve the approved fictional Shen Yan face, age, topknot, body and medicine case across exactly front, left profile and back full-body views. Dress him in the Tang-inspired Xuanheng ceremonial robe with peacock blue, warm ivory and restrained aged gold, heavy patterned silk, supported waist and navy textile boots. Photograph on a bright warm-ivory 85mm studio with realistic cloth weight and contact shadow; exclude scenery, text, extra people, leather, Qing style and actor likeness.",
      "continuityLocks": ["same_face", "same_hair", "same_anatomy", "same_outfit", "same_footwear", "same_prop"],
      "avoidItems": ["no_text", "no_watermark", "no_extra_people", "no_actor_likeness", "no_modern_leather", "no_qing_clothing", "no_identity_drift", "no_prop_mutation"],
      "reviewStatus": "pending_human_review",
      "reviewChecks": ["identity_consistency", "view_consistency", "proportions", "hands", "feet", "garment_construction", "material_fidelity", "footwear", "prop_continuity", "no_text_or_watermark", "no_actor_likeness"],
      "artifact": {"mediaType": "image/png", "byteLength": 2237195, "width": 1536, "height": 1024, "sha256": "297b2a8d5a4c55ec2b0e9524577f57b370fa827c3cac053b31cc5a7fb92b9aa0"}
    },
    {
      "assetId": "turnaround.outfit.shen_yan_yaoyuan_combat.v1",
      "assetKind": "outfit_turnaround",
      "subjectId": "character.shen_yan",
      "outfitId": "outfit.shen_yan_yaoyuan_combat.v1",
      "sourceAnchor": {
        "assetId": "identity.shen_yan.v1",
        "path": "content/visual-candidates/cx508/identity-anchors/identity_shen_yan_v1.png",
        "sha256": "1a0973205fac132f1f5d3c658f8921200d5ce4ca7575182a2c85ab80eb166e50"
      },
      "generationMode": "codex_builtin_imagegen",
      "adoptionStatus": "needs_review",
      "adopted": false,
      "shipInBuild": false,
      "outputPath": "content/visual-candidates/cx517/turnarounds/turnaround_outfit_shen_yan_yaoyuan_combat_v1.png",
      "views": ["front", "left_profile", "back"],
      "prompt": "Preserve the approved fictional Shen Yan identity, hair, mature proportions and rigid medicine case in exactly front, left profile and back full-body views. Replace the robe with the deep-blue and teal Yaoyuan combat outfit using fitted woven layers, restrained matte textile guards, dense cord and reinforced cloth boots without bulky armor. Use high-key warm-ivory 85mm costume photography with readable physical materials; exclude scenery, text, extra people, leather, Qing style and actor likeness.",
      "continuityLocks": ["same_face", "same_hair", "same_anatomy", "same_outfit", "same_footwear", "same_prop"],
      "avoidItems": ["no_text", "no_watermark", "no_extra_people", "no_actor_likeness", "no_modern_leather", "no_qing_clothing", "no_identity_drift", "no_prop_mutation"],
      "reviewStatus": "pending_human_review",
      "reviewChecks": ["identity_consistency", "view_consistency", "proportions", "hands", "feet", "garment_construction", "material_fidelity", "footwear", "prop_continuity", "no_text_or_watermark", "no_actor_likeness"],
      "artifact": {"mediaType": "image/png", "byteLength": 2238780, "width": 1536, "height": 1024, "sha256": "154d28137fee552b14ce301231579020d8e0adfd891295816fb4e48c37f16ef9"}
    },
    {
      "assetId": "turnaround.outfit.chu_mingqi_jiyue_travel.v1",
      "assetKind": "outfit_turnaround",
      "subjectId": "character.chu_mingqi",
      "outfitId": "outfit.chu_mingqi_jiyue_travel.v1",
      "sourceAnchor": {
        "assetId": "identity.chu_mingqi.v2",
        "path": "content/visual-candidates/cx509/identity-anchors/identity_chu_mingqi_v2.png",
        "sha256": "ad13ade5efe7c4451919b16ede690520de64e6ae79680e55f7a1926c6cac29ae"
      },
      "generationMode": "codex_builtin_imagegen",
      "adoptionStatus": "needs_review",
      "adopted": false,
      "shipInBuild": false,
      "outputPath": "content/visual-candidates/cx517/turnarounds/turnaround_outfit_chu_mingqi_jiyue_travel_v1.png",
      "views": ["front", "left_profile", "back"],